{
  "program_id": "program-golden-001",
  "idempotency_key": "idempotency-golden-001",
  "document_id": "doc-golden",
  "expected_revision": 1,
  "registry_version": "cad.program/0.1",
  "runtime_binding": {
    "runtime_id": "managed_dotnet",
    "host_family": "R25",
    "host_version": "0.1.0",
    "package_hash": "sha256:aaaaaaaaaaaaaaaaaaaaaaaaaaaaaaaaaaaaaaaaaaaaaaaaaaaaaaaaaaaaaaaa"
  },
  "operations": [
    {
      "kind": "ensure_layer",
      "operation_id": "layer-001",
      "name": "MCP-PREVIEW",
      "color_index": 3
    },
    {
      "kind": "create_line",
      "operation_id": "line-001",
      "layer": "MCP-PREVIEW",
      "start": { "x": 0, "y": 0, "z": 0 },
      "end": { "x": 100, "y": 0, "z": 0 }
    },
    {
      "kind": "create_circle",
      "operation_id": "circle-001",
      "layer": "MCP-PREVIEW",
      "center": { "x": 50, "y": 50, "z": 0 },
      "radius": 10
    },
    {
      "kind": "create_polyline",
      "operation_id": "polyline-001",
      "layer": "MCP-PREVIEW",
      "vertices": [
        { "x": 0, "y": 0, "z": 0 },
        { "x": 20, "y": 0, "z": 0 },
        { "x": 20, "y": 20, "z": 0 }
      ],
      "closed": true
    },
    {
      "kind": "create_text",
      "operation_id": "text-001",
      "layer": "MCP-PREVIEW",
      "position": { "x": 5, "y": 5, "z": 0 },
      "text": "CAD Program 0.1",
      "height": 2.5,
      "rotation_radians": 0
    }
  ]
}
